20,"Adaptable: The weapon is a truly lethal implement and has a collection of physical improvements meant to provide alternative methods of defeating the enemy. The weapon has been modified to allow the wielder to deal different types of damage than the weapon is typically capable of. Invaluable for roving adventures and traveling monster hunters who may run into creatures who are resistant or completely immune to certain types of damage and who wish to carry just one weapon rather than waste their time and energy carrying several bulky weapons at once. It also provides the added benefit of allow the wielder to subdue an civilian or relatively innocent bystander without killing them and raising the ire of the guards or risking the loss of additional gold from a live bounty. Bludgeoning weapons are counterbalanced with a axe-like blades and topped with sharpened points. Slashing weapons are tipped with spear-like heads and bear larger, heavier, ridged pommels allowing the wielder to pummel a foe. Piercing weapons have accentuated bladed points capable of penetrated or cutting and either the business end or grip is weighted to provide a makeshift club. Furthermore, a small section of the weapon (Typically next to the bludgeoning end) has been covered in layers of leather, rubber or resin creating a painful but relatively safe point of contact. When the wielder attacks the PC may choose to have the weapon deal the standard type of damage the weapon typically deals, or instead have it deal either bludgeoning, slashing, piercing or nonlethal / stun damage (See Note). The weapon otherwise has the same statistics and this does not change anything about the way the weapon operates other than its damage type. —Note: Not recommended for projectile weapons. If your game system does not use damage types and this bonuses would provide no mechanical benefit, roll again. When a creature takes nonlethal /stun damage, keep a running total of how much they've accumulated. Do not deduct the nonlethal damage number from their current hit points. When the amount of nonlethal damage exceeds the creature's current hit points, they fall unconscious but stable. If this is too annoying to manage, simply allow that when the wielder reduces a creature to 0 hit points with an attack, the wielder can knock the creature out, leaving him unconscious but stable."
21,"Twinned: Rather than one single businesses end like a typical weapon, this object has two smaller identical lethal points. While it is difficult to gain the full combat benefits of having the doubled weapon, it is no less lethal than a standard one of its kind. A bludgeoning weapon for example may have two smaller warhammer next to each other. The reduced impact area of each face delivers a more directed impact making it just as dangerous to be struck by and twice deadly to be struck by both creating two spaced out injuries. A singular bladed or piecing weapon might be split partly down the middle like an overeager fuller, doubling the amount of sharp edges and stabbing points, while making the blade lighter and more maneuverable. Ranged weapons are modified to fire two pieces of ammunition simultaneously (This can be ruled as fluff description for balance so the wielder doesn't actually use twice as much ammunition) potentially doubling the chance of injury to the target. Not surprisingly, the larger and more complex the weapon, the harder it is to actually make use of the twinned business ends. It is fairly easy to stab a creature with a two pronged dagger but it is far more lethal to successfully cleave an enemy in half with a halberd bearing two forward facing, sharped crescent blades that slice into the target. Whenever the player rolls a damage die he must roll a second confirming die of the same sort. If the second die is the same result as the first, the player adds both dice to the total damage rolled. —Note: Combat example: The wielder attacks with a twinned halberd, hits and rolls 1d10 damage. The first damage die is a 6 and the confirming die is also a 6. Since the rolls match, the wielder deals 12 damage instead of 6. If the confirming die was a 10 the wielder would deal the original 6 damage. This only affects the weapon's damage itself and not other sources of additional damage such as sneak attack, divine smite or spell effects. I recommend that the player or DM assign a color system so avoid confusion, for example the first die is always blue and the confirming die is always red. This way both dice can be rolled at the same die to speed the process along."
22,"Quickdraw: A weapon with this bonus has been created with an impressive, ergonomic design that allows it to be effortlessly drawn forth by the wielder. Even the sheath, straps or carry clips have undergone modifications so that the wielder can easily make adjustments to stow it in wherever is most comfortable for them while still being instantly accessible. This allows the bearer to place the weapon in an area on their body where their hands instinctively go to as a response to combat or stressful situations. The bearer is able to draw the weapon as a free action whenever he rolls initiative as long as he physically capable of doing so. The weapon is so naturally drawn forth that the wielder is even able to impulsively (If crudely) defend himself in the heat of the moment and in the first round of combat if a hostile creature comes within the wielder's reach (Or 20 feet for a ranged weapon) he is able to make an attack of opportunity against that creature but suffers disadvantage on the attack roll. Lastly, drawing and stowing the weapon is considered a free action. To benefit from the weapon's bonuses, the bearer must have spent at least one hour adjusting the weapon and its sheath in the most optimal position for his own unique frame and habits. Once comfortable, the bearer only has to readjust the straps if the weapon has been changed to be used by someone else."
23,"Unforgiving: The grisly looking weapon has been designed to be extraordinarily effective during powerful finishing attacks. The wielder is able to manipulate the weapon to great effect when landing strikes that hit the target's vital areas and the additional features cause the implement to be particularly lethal on decisive attacks. Whenever the wielder scores a critical hit with the weapon, the player may select any single damage die of his choosing (See Note) and that die will be considered to have rolled the maximum possible result for that type of instead of the current result. This must be done after damage is rolled but before it is dealt to the target. —Note: This affects the weapon's damage itself AND other sources of additional damage such as sneak attack, divine smite or spell effects."
24,"Reach: A weapon with this bonus sports a number of features all designed to extend the wielder's effective threat radius, allowing him to attack enemies that would normally be out of reach. A melee weapon might have a longer haft or blade, or have a bludgeoning end on a short length of chain, allowing the blunt surface to be snapped out at a distant enemy. The weapon might be abnormally balanced or telescopic, allowing it to be overextended with ease, giving the wielder the ability to strike at range without falling over or leaving themselves exposed to retaliatory attacks. Ranged weapons with this quality sport thicker bowstrings and enhanced limbs, launching the projectiles even further than normal. Ammunition and thrown weapon bear aerodynamic grooving, masterful fletching, and weight distribution all meant for them to fly farther than they normally would. Melee weapons with this bonus add 5 feet to the wielder's reach when he attacks with it, as well as when determining his reach for opportunity attacks with it. Ammunition, ranged and thrown weapons all add 20 feet to their normal and long distance attack ranges. There is however a downside to these modifications, as the weapons were originally designed to be shorter and smaller for good reasons. While the improved length and extended reach excel at hitting a foe from afar and keeping the fight at bay, they make it difficult to properly attack an enemy that is immediately adjacent to the wielder. Melee Reach weapons are cumbersome in close quarters and the wielder suffers disadvantage on attack rolls against targets within 5 feet of himself. Ranged weapons and projectiles with this bonus are meant for longer flights, making them difficult to aim properly without being given distance to stabilize causing the wielder to suffer disadvantage on attack rolls against targets within 10 feet of himself."
25,"Rebounding: The weapon is roughly half as heavy as a typical one of kind, made of lightweight materials arranged in an interconnected fashion that renders it just as durable as a standard weapon of its kind. In the grip of Rebounding melee weapons rests a core of rubbery, springy substance that causes the weapon to bounce back slightly with each hit aiding the wielder to get back into a fighting stance a fraction of a second faster than a normal. On particularly powerful blows, the weapon rebounds with enough force that the wielder can try to stab or swing again at the same spot, aggravating the severe injury even further. Projectile weapons with this bonus are crafted in such a way to place a mild spin on their ammunition causing them to corkscrew into the wound creating a hideously maiming injury if the wielder lands the shot just right. In thrown weapons and ammunition, the objects are designed to shatter on impact, hopefully leaving debris in the target's body or potentially spraying shrapnel over the victim creating a wide area of serious lacerations. Following up with a secondary attack or landing a projectile in optimal area is a combination of luck and skill and not always possible. Whenever the wielder scores a critical hit he can attempt to confirm the followup strike. The player immediately makes another attack roll (See Note) with all the same modifiers as the initial attack. If the wielder's confirmation attack roll also results in a hit against the target's armor class, the followup attack is successful and the wielder deals additional damage on the critical hit equal to the maximum result of one of the weapon's damage dice (Like an 8 on a d8) the player rolled for the attack's damage. The confirmation roll just needs to be enough to hit the target normally, it doesn't need to be a critical hit again. If the secondary attack roll would be considered a miss, then the initial attack is still considered a critical hit. —Note: This secondary attack role is not another true attack and does not take an action or use any resources. A combat example: A PC wielding a Rebounding Mace rolls a natural 20 against the target and attempts a secondary attack roll. The PC then rolls another attack to confirm the critical and gets a result of 18, which is less than the target's armor class of 15. Since the confirmation rolls is a hit, the PC will add +8 (Assuming that the mace uses 1d8 for damage) damage to the normal damage resulting from the critical hit."
26,"Decisive: The weapon has been shaped and formed with the precise eye of a master crafter. Built in a way to reward accuracy and efficiency, the bladed edge, sharpened tip or contact point has been reinforced with a small amount of a stronger, denser material. This substance is exceedingly rare and exorbitantly expensive even in such a minute quantity but it is enough to greatly increase the weapon's lethality, if the wielder is skilled enough to hit the target just right. Although the weapon is no less lethal than one of its peers in the hands of an amateur, only a true professional killer in favorable conditions can really drive the rare material of the weapon hard into the enemy. Whenever the wielder attacks with advantage and hits the target, if the lower of the two d20 results would have also hit the target, the player can roll one of the weapon's damage dice one additional time and add the result to the damage dealt by the attack. —Note: This works best in the D&D 5e Advantage / Disadvantage concept. In other systems the extra damage might kick in if the PC would have hit the target with its straight d20 roll without bonuses or if the attack roll exceeded the target's AC by 5 or more. This only affects the weapon's damage die itself and not other sources of additional damage such as sneak attack, divine smite or spell effects. Projectile weapons with this improvement bestow the bonus upon their ammunition for the turn that it's fired."
27,"Hooked: The weapon bears a number of curling, spikes, backwards pointed hooks or is curved much more than a typical one of its kind. These crooks and grapples can catch on the enemy's weapons, shields, legs and arms allowing the wielder to push and pull the target off balance. In an odd design quirk, these offensive anchors are placed in such a way that they can only way to properly utilized on the backswing of a particularly accurate blow. Ranged weapons are crafted in such a way to place a mild spin on the projectiles causing them to penetrate while turning, creating injuries designed to maim. In thrown weapons and ammunition, barbs and serrated edges which facilitates the same effect. While difficult to achieve, the benefit of this construction is that the precise nature of the hooks combined with the well landed blow denies the target a chance to properly defend themselves. Whenever the wielder attacks with advantage and hits the target, if the lower of the two d20 results would have also hit the target, the player can choose to either trip, grapple, disarm or shove the target five feet backwards and that combat maneuver automatically succeeds. —Note: This works best in the D&D 5e Advantage / Disadvantage concept. In other systems the bonus might kick in if the PC would have hit the target with its straight d20 roll without bonuses or if the attack roll exceeded the target's AC by 5 or more. Projectile weapons with this improvement bestow the bonus upon their ammunition for the turn that it's fired."
28,"Cunning: The weapon is a model of combat utility making it perfect for harrying and debilitating opponents rather than directly injuring. The business end is undersized leaving room for a variety of modifications making it simple to perform specialized combat maneuvers. Often these takes the form of large barbs or hooks, serrated blades or an improved weight distribution that allows the wielder to better hinder, harass, and hobble his opponent. The hooks and counterbalancing greatly improves the wielder's ability to trip, feint, grapple, pin, disarm, sunder, push and shove his opponents. Whenever the wielder successfully attacks a target, instead of rolling damage he can choose to deal the minimum result possible on his weapon damage roll (Like a 1 on a d8) and immediately attempt to make one of the previously mentioned combat maneuvers checks against the target. These follow the standard rules within the game system for resolving combat maneuvers and if none exist see Note. ------Note: This affects additional damage dice from critical hits but not die from other sources such as divine smite, sneak attack or spell effects. If your system doesn't have rules for a contesting combat maneuvers, use this: The wielder declares the maneuver and chooses to make either a Strength or Dexterity check which is contested against the target's Strength or Dexterity check (Target chooses the ability to use). If the wielder has the higher result, the target falls prone, disarmed of one object they're holding, knocked back five feet, grappled, etc. If the target wins the contest, there is no effect and the action is consumed without effect. Recommended for melee weapons only, although certain throwing weapons or ammunition such as bolas or arrows designed to disarming or tripping could certainty be beneficial to a PC."