68,"Spear of the Unpierced: A long spear made from bone, topped with a straight, helical horn bound to the bone with thick white hair. Knowledgeable PC's will discovery that all parts of the weapon originated from a singular unicorn. No matter its circumstances, the weapon remains free of scratches, nicks, sweat, blood and gore, remaining untouched as if saving itself. The weapon instills feelings of purity, patience and self-control when held. The weapon glows slightly and is treated as +1 when wielded by a virgin creature. —Note: Themes regarding sexuality may not be appropriate for all groups and DM's should use their discretion on if this enchantment is worth adding into their campaign or if it would be too distracting, immersion breaking or uncomfortable."
69,"Ebb Tide: A weighted net woven from the hair of the drowned, with heavy shells and chunks sea glass distributed around its edge. A knowledgeable PC will notice that the small etchings on the glass and shells, marks the net as blessed by a sea witch and given to mermaids in order to better drown the lonely men they lure into their watery domains. A creature entangled by the net has disadvantage on all checks made to swim, any rolls to resist drowning and can only hold their breath for half as long as normal. The weapon moves through water as easily as it does through air, suffering no penalties when attacking underwater targets."
70,"Mage's Hook: A brightly polished, steel, prosthetic hook hand that glows slightly when worn by a creature capable of casting magical spells. Made for mage's who have lost limbs, this hook counts as a working hand for the completion of any spells that require hand motions or somatic components. It can also be used in place of a hand for spells that require the caster to physically touch the target. Furthermore if the bearer of the hook is a missing a hand, and is capable of casting spells, they become proficient in the use of the hook as a weapon (Dagger statistics) and it is treated as a +1."
71,"The Emerald Blade: A jagged ^RandomSword^ lined with emerald teeth forming a gnashing edge. Whenever it inflicts a wound, live plants sprout from the lacerations instead of blood. These plants usually cause no more additional injury but the odd spontaneous growth of nature causes roots to spread directly into the victim's arteries, bones, nerves or interlocking joints, causing further pain and suffering. Whenever the player rolls the maximum result on the sword's damage die (I.e. a 6 on a six-sided die, see Note), they can roll that die an additional time and add both results to the total damage dealt. This ability can trigger multiple times per turn but only once per attack. If the bearer is injured while wielding the weapon, he bleeds sap rather than blood that quickly coagulates into a thick pad of lichen. Once per minute if the blade is plunged into the earth, luscious healthy grasses, clovers and wildflowers instantaneously sprout up one foot high, in a five foot radius around the sword. The plants are healthy and root if possible in whatever soil is available but afterwards they will live or die based on the local environment. The sword rests in a wooden scabbard set with a single sparkling amber gem. —Note: This only affects the weapon's damage itself and not other sources of additional damage such as sneak attack, divine smite or spell effects."
72,"Ishmael's Call: A wicked looking harpoon (Javelin statistics), made from the jagged, scrimshaw-carved tusk of a narwhal and attached to a 50-foot length of woven sinew. The wielder feels an extremely heightened drive to seek revenge on those who have harmed him physically and a nearly uncontrollable urge to kill those who have caused him to lose a limb. The weapon moves through water as easily as it does through air, suffering no penalties when attacking underwater targets. If the wielder has ahold of the end of the sinew rope in one hand and throws the harpoon with the other, after the weapon has hit of missed the target the wielder may call the harpoon back with a thought, causing it and the full length of rope instantly reappear in his hand. The weapon is treated as a +1 weapon if the wielder is missing a limb."
73,"Featherweight Darts, Tracking: A small wooden case containing a dozen extremely small, lightweight darts. These fragile darts have barbed needle-like heads which are too small to deal damage on their own. When a dart hits exposed skin, the thin shaft breaks off, leaving the base of the fine barbed head flush with the flesh and nearly impossible to spot. These tools are made to track lone or unintelligent prey who lack the awareness, help or resources to notice and remove the darts once embedded. Once a dart pieces the skin of a creature, it begins to emit light and noise to aid the wielder track the victim. Before firing, the wielder may focus on the dart to command it to glow with the intensity of a torch in any color the wielder chooses, and emit any sound the wielder can imaging up to as loud as a whistle blast. The wielder can alternate the colors, and sounds in order to create a loop of no more than six seconds. The wielder must make these choices before the dart is fired, and they cannot be changed afterwards. If no choices are made, the darts default to blue and red lights that alternate every other second with a piercing whistle blast every six seconds. The creature who has an active dart embedded in their flesh is completely unable to see or hear the light and sound the dart creates. A dart functions for one hour after penetrating flesh or until it is removed. In either case, an individual dart is destroyed after its purpose is served and cannot be reused. The barb can be removed without issue in one round with proper equipment and a successful medicine check or by quickly cutting out the barb dealing 1d2 damage. The small darts are meant to be used in both blowguns and wrist launchers but can be thrown by hand or fired from a hand crossbow while suffering disadvantage on the attack roll."
74,"Dragathil: A slightly curved rapier with a grip crafted perfectly for elf and human hands but will still accommodate other races. It has a row of small rubies down the center of the blade and a large basket hilt in the form of roses twined around three harps. Dragathil glows with a fierce red light when drawn, but despite its fearsome appearance, it is designed to subdue opponents peacefully rather than smite them with arcane fire or razor-sharp steel. The weapon is treated as a +1 but all of the damage dealt by it is considered non lethal / stun. The weapon leaves no visible marks of injury nor will it ever kill any of the targets struck by it. If a target would take damage that would result in death they are instead rendered unconscious, but stable. —Note: Some systems do not use non lethal / stun damage mechanics and this weapon may be more powerful because of that. In those cases a DM may use their discretion to rule that certain types of creatures such as undead, constructs, elementals or gelatinous cubes may be resistant or immune to the nonlethal damage caused by this weapon."
75,"Bolt to Freedom: A slick, wooden quiver covered in a glassy lacquer containing a dozen crossbow bolts. Each piece of ammunition is perpetually coated in a thin film of oil or grease. The bolts leave a thin, oily residue on everything they touch and targets hit by one become covered with a thin layer of grease. The slippery coating hinders the target's ability to become restrained or to restrain others. A creature hit by a bolt suffers disadvantage on any rolls made to initiate or maintain a grapple or restraint and gains advantage on any check made to break free of a grapple or restraint of any kind. This effect lasts until the start of the wielder's next turn."
76,"Legion-Breaker: A long, heavy-bladed bastard sword that has been the weapon of conquerors and revolutionaries alike. The edge is notched and scarred from centuries of warfare and the heavy, human-form brass hilt lends the blade a remarkable sense of balance for its size and weight. Unlike many magical weapons, this blade was not wrought to slay monsters or demons, but to empower the few to slaughter the many. The wielders of this blade often find themselves drawn to the forefront of rebellions, invasions and the defense of homelands from the endless hordes that clamor constantly at their border. During combat, the weapon surges with power when its wielder is outnumbered and when the wielder has more enemies than allies in battle the weapon is treated as a +1. The exception to this is when the wielder started with a smaller allied force than his enemy and slaughtered his way into superior numbers. The one who carries Legion Breaker into battle will never tire so long as he continues the fight. Wars consists of many protracted battles and dozens if not hundreds of skirmishes, raids and feinting pushes. If the weapon is treated as a +1 active combat, the wielder is able to ignore his fatigue and the wielder is rendered immune from any and all the negative effects from exhaustion that he may be suffering from. Once combat is over however the wielder is no longer sheltered by adrenaline and the effects of exhaustion return in full."
77,"Demonsorrow: A long, thin-bladed scimitar whose hilt resembles a beautiful angel with elven features. Elaborately detailed feathered wings spread from the hilt to form the guard, with the angel's face at the base of the blade. The cold iron crescent blade hinders those it was created to destroy, forcing them to turn on the wielder with extreme prejudice when would normally flee. When the scimitar is being wielded by a living creature it is treated as a +1 against demons and fiends and whenever such creature attempts to teleport while within 50 feet of the wielder, there is a 25% chance that the attempt fails, wasting the creature's action and spell resources. An abyssal creature barred from teleporting is aware that the scimitar is producing the effect, is imparted with the distance and direction of Demmonsorrow and knows that should the wielder die, the demon is free to leave."
78,"Crossbow of the Infinite Sky: A hand crossbow with infinity symbols engraved on both sides of its mother of pearl grip. The barrel is adorned with gold depicting the moon, planets, and stars against a night sky of the weapon's cold black steel. The crossbow never needs to be manually reloaded and after one shot is fired, a non magical bolt from somewhere on the wielder's person is teleported into the automatically restrung barrel. Unfortunately due to a quirk of the enchantment, the weapon can never be fitted with magical bolts of any kind, as it will not magically load them and the prideful crossbow refuses to be hand loaded like some sort of peasant's weapon."
79,"Halfling's Exit: A black leather pouch that contains a dozen grey sling bullets, each one seemingly filled with swirls of thick, black fog, their surface roiling with constant motion. These bullets provide a ready cover for those needing a quick escape and are often carried by rogues, infiltrators and assassins in case such situations arise. Upon impact with a target, the ammunition emits a deafening crack and releases a billowing cloud of smoke that fills a five foot square with dense black mist. If the target is a creature, the victim's space becomes engulfed in the opaque smoke and he effectively blinded but also gains full cover from outside attacks. All creatures within 30 feet of the impact are momentarily distracted and suffer disadvantage on visual perception checks until the start of the wielder's next turn. The dark fog is harmless, causing no injury and dissipating completely at the start of the wielder's next turn. A wielder proficient with slings suffers no penalty on their accuracy roll should they throw a bullet by hand at any space or unattended object (Including their own feet) within 15 feet, so that they can escape behind the smokescreen or to obscure a door or window."
80,"Cradle to Grave: A ritual dagger etched with spider web designs and a hilt shaped like a skeleton that has been laid to rest. The ceremonial blade prominently displays the holy symbol of Pharasma, the Goddess of birth, death, rebirth and prophecy. Knowledge PC's are aware that daggers like these are used during ceremonies sacred to the Lady of Graves, such as to cut umbilical cords of newborns or to preside over the corpses of the honored dead as their spirits travel to their resting place in the Great Beyond. The Goddess of the cyclical cycle of life, death and rebirth is well familiar with her domains and wishes them to happen smoothly and without interference by those who would disrupt the pattern with abominations. While the dagger is in the bearer's possession he is considered proficient in any medicine checks for the purposes of midwifery and childbirth. A newborn whose umbilical cord is severed with the knife is blessed by the Goddess and gains advantage on all constitution based checks and saves for the next seven days. A bearer who uses the dagger as part of an hour-long ritual of prayer over a corpse, bestows the protection of the Shepherd of Spirits over the empty vessel. The remains are protected from rot and decay and cannot become undead or be raised from the dead for a period of seven days. The goddess abhors the wretched undead and the dagger is treated as a +1 against undead creatures. A bearer who has ever created, raised, summoned or commanded an undead creature is not able to make use of the dagger powers, nor are they considered proficient in the weapon."
81,"Fateblade: An fairly unadorned ^RandomSword^, whose pommel is carved to look like a large unblinking eye. The twinned symbol of the Goddess of Fate and Death is stained into the weapon's grip with dried blood that refuses to be wiped away. The weapon appears to be a physical manifestation of destiny that allows its wielder to alter reality for their own personal gain. In combat, the wielder could swear that with each swing of the sword they experience two different simultaneous strikes against the target, in a sort of violent deja-vu. In the briefest fraction of time during the swing, the wielder can see the result of both strikes and can choose their own fate and that of their victim. Whenever the player rolls to determine the weapon's damage (See Note), he may roll the weapon's damage die twice and choose either result to use. After spending some time with the weapon in his possession, the bearer begins to receive strange new sensations of things yet to come and glimpses of the future begin to press in on his awareness. Some of these premonitions are flashes of second sight into the bearer's malleable destiny and can be exploited to reweave the threads of fate. After finishing a long rest during which the weapon has been in the bearer's possession, the player rolls 1d20 and records the number rolled. While the weapon is wielded by that specific bearer, he can choose to replace any attack roll made by the wielder or a creature that he can see with the foretelling roll. The wielder must choose to do so before the roll is made. The foretelling roll can be used only once and when the bearer finishes another long rest, he loses any unused foretelling rolls. —Note: This only affects the weapon's damage itself and not other sources of additional damage such as sneak attack, divine smite or spell effects."
82,"Blade Of The Sword-Saint: An exquisitely forged katana that is the result of painstaking attention and craftsmanship by one who was dedicated to mastering swordplay in its highest form. The implement draws upon its wielder's desire for the perfection of their martial style, distilling that dedication and energy into to a palpable force and releasing it towards the target. Each time the weapon swings in their direction, the target's mind is flooded with white hot needles of shame and inadequacy as they are made painfully aware that their weapon and fighting form are no match for the wielder's. Whenever the wielder attacks a creature, that target is dealt one point of psychic damage, even if the attack missed, was blocked or otherwise resisted."
83,"Stormbringer: A huge, finely-wrought zweihänder runesword (Fullblade statistics), with a blade at least five feet long from the hilt. The hilt itself is embedded with a large spherical ruby that resembles an eye. The blade is made entirely from an unearthly, vaguely flesh-like black metal, and is etched with mysterious runes so ancient that even extremely knowledgeable PC's cannot decipher. The runes can sometimes be seen to glow and change colour, cycling from red and purple to blue. Perhaps the most unsettling aspect of Stormbringer is that is has been instilled with a small amount of malicious intelligence, perception and memory, and that it is in some part alive and self aware. The wielder faintly perceives the weapon's simple mind at the edge of their consciousness and the giant sword is quite vocal, with a near constant telepathic chatter of screaming, grumbling, howling, murmuring, moaning, and even singing at times. The weapon is able to perceive its environment in the same way a human can (Sight, smell, sound etc.) to a maximum of a five foot radius around itself. Stormbringer can answer simple fact based, or yes/no questions about its origin, history, past wielders, targets it struck, etc. The fullblade does not lie but is not able to answer complex questions or those that depend on feelings, extensive logical deductions or situations it has never witnessed. In combat the weapon becomes wreathed in black light and dark fire and it screams in battle with such force that half of the damage dealt by the weapon is considered thunder damage while the rest is normal for it's type. Due to this effect, the wielder automatically fails any stealth checks made while Stormbringer is used in combat."
84,"Mah'alleinir: A warhammer measuring about four feet long, with a large brick shaped head, a long metal handle, and the imprint of a leaping wolf on the side of its head. It resembles an oversized blacksmith's hammer more than it does a “traditional” warhammer and it sports a wedge-shaped back in place of the typical armor-piercing spike common on typical warhammer designs. After three days in the possession of a bearer who has never deliberately harmed or killed a wolf, the bearer's eyes become a bright yellow even golden color, glow faintly in the dark and catch the light, granting a wolfish appearance. This effect fades 24 hours after the weapon has left the wielder's possession. A wolf eyed wielder takes on some of the heightened senses of the untamed wolf and can see in low or dim light as if it was bright light and gains advantage to any perception checks made regarding their sense of smell. Wolves are pack hunters and a golden eyed bearer instinctually benefits from a nearby ally while in combat, using the minor distraction to go for the enemy's throat. The wielder gains a +1 on damage rolls with Mah'alleinir if an allied creature is within five feet of the target. Bearers who have ever harmed or killed wolves feel a strong sense of betrayal and revulsion when touching the warhammer and they cannot benefit from its magic nor are they considered proficient with the weapon."
85,Wuuthrad: A two-handed greataxe with blades on both sides. The weapon has a long ebony handle that leads to its twin-bladed head and ends in a sharp point at the top. The weapon is coloured almost entirely in a muted grayish tone and prominently features the face of a screaming elf on the head of the axe. The mighty axe was hewn from sorrow in the wake of a great lost and Knowledgeable PC's understand the weapon's name translates to “Storm's Tears” in the ancient language of Atmora. The greataxe is particularly deadly against elves and is treated as a +1 weapon against them and elven creatures are never considered proficient with Wuuthrad.
86,"Mind Killer: An illithid wrought greatsword whose hilt is swaddled in fine leather harvested from the past victims of mind flayers. The blade resembles a great black tentacle with phosphorescent green veining running through its sinuous length. The weapon grants its wielder a form of extrasensory perception that straddles the line between superhumanly insightful and true psionic power. An experienced wielder with a discerning mind gains a sudden flash of understanding after striking the enemy and is able to make educated guess on the foe's next move and defend accordingly. Whenever the wielder successfully attacks a target with a lower wisdom score than himself, the wielder's armor class or physical defensiveness increases as if he was properly wielding a shield (Typically a +2) against the next attack made by the target until the end of its next turn."
87,"Silver Sickle of Soranth: A silver sickle forged in the shape of a crescent moon. The handle is made of duskwood, wrapped in the blackened leather of a werewolf pelt. Four pictographs (One on each side of each blade) depict one of the elements killing a wolf like beast. One shows the canine drowning, one shows the canine burning, one shows the canine being crushed under a rock, and one shows the canine gasping for air. The silvered weapon is treated as a +1 against shapeshifters and lycanthropes, and such creatures are never considered proficient with the sickle."
88,"The Fountain of Infinite Gore: A huge square bladed greatsword that was originally a giant's cleaver whose handle has been replaced. The heavy blade has a triangular cross-section and is truly menacing to behold. A red string it wound tightly around the tip of the handle and a small golden ring dangles down from the grip. The weapon's butchering design allows the wielder's blows to potentially carve through multiple foes at a time on particularly lethal attacks. Once per round when the wielder scores a critical hit with the weapon or reduces a creature to 0 hit points with it, he can immediately make an additional attack with the weapon against a creature within reach. The repurposed cleaver's lethal design is so murderously effective that the wielder can never choose to deal nonlethal or stun damage with it and whenever the wielder deals enough damage to bring an enemy to 0 hit points or less and has the choice between incapacitating or killing them, the wielder must always kill them."
89,"God's Tongue: One-handed mace made from an electrum alloy, divinely enchanted to become stronger than steel. The holy symbol of the God of ^GoodDomains^ is stamped into the grip, and presses into the wielder's hand when held .The weapon is a smooth blend of silver and gold, with the grip being made of pure silver and the tip of the mace's head being pure gold, with a blending of the metals in between. The weapon's crushing flanges are a pristine work of art, cast in white gold and polished to a near mirror sheen. The mace will never allow itself to touch the earth and if dropped, will stop falling an inch above the ground and simply hover until picked up. The weapon is immaculately fresh, dirt, grime, and blood simply falls away from it, leaving it forever gleaming and clean. If banged on an object, the area around the mace will be filled with the sounds of hymns and chanting as loud, as if the air itself were a bell extolling the God's greatness. This effect is a loud as five grown men yelling and lasts until the mace is no longer held, the bearer chooses to suppress the effect or until ten minutes passes. The mace functions as a direct spiritual connection to the deity and a creature make offerings directly to the God in return for a minor blessing. The bearer may lay ten gold coins (See Note) along the surface of the lethal flanges and pray to the God for ten minutes. At the end of this ritual, the gold coins vanish and the weapon is treated as a +1 weapon for the next eight hours but only for the creature who prayed. The bearer feels a strong sense of religious devotion during the eight hour span and feels motivated to carry out the basic tenets of the domain the God represents. The wielder is not compelled to act in this way and is not forced to violate any strongly held morals or beliefs. —Note: Rather than a flat ten gold, the DM can rule of another flat value, X gold per character level or other reasonable amount."
