26,"The Sword of Change: A weapon rumored to have been wrought within the magical balestorm of the northern Chaos Gate, fashioned by the chaos demon Amon, whose fossilized eye is still grasped in the weapon's pommel. The Sword of Change is saturated with wild magic and even the air around the blade is in flux\: at one moment, the blade is wreathed with the scent of sweet perfumes reminiscent of a brothel, only to be replaced a heartbeat later with the stench of rot and decay of a fetid swamp. An eye-blink later and the air around the weapon shines with cheery multi colored hues before being surrounded in a haze of misted blood. The weapon's form is malleable and a wielder who concentrates on the weapon change its form into another type of blade at random (Roll a Random Sword) by spending an action equivalent to attacking or casting a spell. The eldritch weapon has the power to burn, freeze, electrocute, melt, cleanse, taint or even damage the very mind of those whose flesh it pierces. The sword's method of lethality changes with every strike and each time the weapon hits, the player rolls 1d10 and half of the damage dealt by the weapon is considered that damage type (See Note) while the rest is normal for its type. —Note: The following list for the damage types. To save time I recommend the player rolls the damage type d10 at the same time as the damage to speed the process along: 1 = Fire, 2 = Cold, 3 = Acid, 4 = Lighting, 5 = Psychic, 6 = Thunder, 7 = Force, 8 = Poison, 9 = Necrotic, 10 = Radiant."
27,"Yolo's Greataxe: A heavily chipped and notched greataxe made of plain iron. The name “Yolo” is carved sloppily into the haft. The weapon still retains a portion of the tenaciousness and unbridled savagery of its former owner. While wielded, the wielder can disregard their own safety to attack with wild abandon. When the wielder makes their first attack on their turn, they can decide to attack recklessly. Doing so grants the wielder advantage on all melee weapon attack rolls made with this weapon during the turn, but all attack rolls against the wielder have advantage until the start of the wielder's next turn. Knowledgeable PC's will have heard legends of a powerful gnome mercenary who would hurtle himself into combat screaming his own name, heedless of the danger. Much of his history has been lost to time but the name remains, and it is not uncommon to see warriors invoke his blessing as they rush into battle by screaming “Yolo!” at the top of their lungs."
28,"Manreaper: A rusted, sawtoothed scythe that was dipped into the profane filth seeping from the throne of the God of Plagues. The shaft is carved of rot-wood, harvested from the swamp of the God of Plagues with a slimy grip covered in black mold that rubs offs on the wielder's hands before instantly regenerating. A living creature damaged by the weapon is immediately infected with a virulent fungal spores which hamper the body's ability to recuperate. Whenever a living creature damaged by the weapon would be healed (By any source, power or ability whatsoever), roll the amount healed twice and use the lower result. Should the creature instead be healed for a non-rolled amount of hit points, reduce the healing by one to a minimum of zero. The unholy toxins are short lived and the effect only lasts until the start of the wielder's next turn."
29,"Beginner's Luck: A longsword that looks unremarkable but feels uncomfortable in the hand of any creature wielding it. It may feel too heavy, too light, too unbalanced, pinch the wielder's hand or have some other issue that prevents it from feeling right. Whatever the problem is, it does not feel like an effective fighting weapon and the wielder always suffers disadvantage on attack rolls with it. If a creature is foolish enough to actually use in combat, the wielder finds that the longsword always critically hits on a natural 1 in addition to its regular critical range. Knowledgeable PC's will know that legend has it that the weapon was created by a long forgotten artificer who gave it away as a prank. It has been passed around between novice swordsman for centuries as a practical joke, each new recipient being told it was a powerful magic weapon that would reveal its secrets with use."
30,"Toro: A flail consisting of a heavy bamboo shaft attached to a thick brass chain, ending in an ornately carved, six sided, stone lantern with jade and amber motifs. Although well carved, the granite lantern is not actually strictly functional and lacks a receptacle for oil or a candle. When wielded however, the bearer can choose to cause the lantern to alight through sheer force of will. The wielder can spent a moment in concentration to cause the lantern to shine with the brightness of a candle in whatever color the wielder wishes. If the bearer requires more illumination they can choose to funnel a minuscule portion of their own life energy into the weapon (Dealing one point of damage to the wielder.), causing the lantern to shine as brightly as a torch in a color the wielder wishes. In either case, the weapon stops emitting light if the wielder releases it, or after one hour's time, though the wielder can snuff the light simply by thinking it."
31,"Titan's Toothpick: A wickedly sharp bamboo toothpick that was seems to have be made for giants. These towering behemoths often feed by tossing entire animals into their putrid maw and chewing and swallowing the entrails, bones and fur along with the meat. Giants are not well known for their delicate woodworking skills and it is likely this tool was made by a much smaller race. In the hands of a human sized creature, this oral hygiene tool functions perfectly as a six-foot bamboo longspear that smells strongly of mint (A perceptive PC will notice that the weapon's hollow interior is stuffed with packets of dried mint). This giant toothpick was made to resist a giant's firm teeth and fleshy gums while rooting out offending material, but was not meant to be a reusable weapon. When the wielder successfully strikes a target with this weapon, the attack is automatically considered a critical hit and the player is able to reroll all 1's and 2's when determining the damage roll. As part of the attack, the brittle spear explodes in a spray of splinters and ground mint, which deals damage to the wielder equivalent to a dagger and destroys the weapon. Knowledgeable PC's will remember a legend regarding a small village who attempted to foster better relationships with giants by creating these toothpicks in an attempt to reduce the rates of frustrated rampages by giants riddled with pain from infected teeth. According to the stories, the giants appreciated the ability to dig sheep hides out of their teeth after eating an entire heard of livestock and afterwards only rarely flattened that village. —Note: This only affects the weapon's damage itself and not other sources of additional damage such as sneak attack, divine smite or spell effects."
32,"Bo Staff: A six-foot-long quarterstaff made of tapered rattan wood that is thicker in the center than at the ends. The weapon sports a hexagonal cross-section and is reinforced with metal bands around the natural handholds, both of which render is easy to grasp and hold during combat, granting the wielder advantage to any checks made to resist being disarmed of it. The airy symbol of three wavy lines are painted along the length of the staff in beautiful flowing calligraphy. When held, the weapon hums in a deep, centering tone that is barely audible, yet strangely compelling to concentrate on and use as a meditative focus. A wielder feels connected to his inner self and at any time, can assume a relaxed position and enter a meditative trance. In this state the wielder turns his inner eye to his spiritual self and becomes unaware of his surroundings. The wielder is aware of how long he's been meditating for and can instantly rouse himself from the trance becoming fully awake at any time. He is automatically roused from the trance if he takes any sort of damage, is physically moved, his name is spoken within earshot or if he is no longer touching the weapon. Time spent in this meditative state fulfills the same purpose as sleeping for an equivalent amount of time (Making eight hours of broken up meditation over the course of a 24 hour period equivalent to a full night's sleep) but they must meditate in at least 30 minute increments to gain the benefit. The staff must match itself to its bearer's specific energy flows and a creature must meditate using the weapon for a period of four consecutive hours before they can benefit from the meditative sleep. The staff can only be attuned to one creature at a time. Knowledgeable PC's will know that this staff and its magical enchantment was originally developed by an order of monks to grant their warriors a meditation aid should the traumatic memories of combat (Typically desperate acts of self-defense against bandits and thieves) disrupt their ability to concentrate on calming their spirits. To their great disappointment, when the enchantment was shared with the world in an attempt to foster peace, serenity and self-reflection it was used mostly by armies (Especially mercenary companies) to allow their soldiers to sleep at will in a seated position. These armies were able to do away with bedrolls, tents, camping gear and other items of comfort and sleep, turning the army into a large band of quickly moving, nomadic raiders that never had to stay in any location for more than an hour or two and didn't have to entrench or defend a sleeping camp. The monks have since cut ties to those they shared their magic with, retreated to their secluded monasteries and grown disillusioned with the nobility of the human soul."
33,"Sword of Frost and Flame: A ^RandomSword^ whose cutting edge appears to be entirely made of a leashed ice storm and a caged bonfire, both bound within the rough confines of where the blade should be. The elemental magics are constantly fighting to overtake the over, the opposing energies producing explosive power that burns and freezes anything the weapon contacts. The sword has no physical blade whatsoever as it relies on its magic to kill anything that it strikes. Half of the damage dealt by the weapon is considered fire damage while the rest is cold damage, it deals no mundane damage at all."
34,"Forewarning Flail: A well-crafted knight's flail with the symbol of a ^RandomCreatureTypes^ etched into its grip. The weapon contains a constantly evolving protective enchantment in order to protect its current wielder from whatever threat killed its previous wielder. This enchantment serves as a warning beacon to its bearer that enemies are nearby and that the wielder should prepare themselves for battle. The flail begins to glow with the intensity of a candle when a creature of the symbol's type is within 200 feet of the weapon. If a creature of that type is within 100 feet of the weapon it shines as bright as a torch. When a creature is within 50 feet of the flail, it emits a shrill whistling noise in additional to the bright light. The bearer is able to suppress or resume any of these effects with a thought. Should the wielder ever be killed, the symbol on the weapon automatically changes itself to the creature type of the entity that killed him. This provides a two in one benefit of recognizing a lethal threat and changing to protect against it in the future and denying that creature the benefit of using the flail's warning magics as it would just be constantly going off. —Note: The DM can assign one color for both lights or two different colors to better differentiate between them such as yellow within 200 feet and red within 100 feet."
35,"Brightstrike: A military issue heavy crossbow, covered with a dark mottled camouflage design and bears the symbol of a shooting star is etched into its grip. The weapon includes 10 modified bolts that are essentially climbing pitons turned ammunition (It can fire typical bolts as well) that can be launched by Brightstrike with enough force to bury itself into a brick or stone wall. These modified bolts are not able to support enough weight to climb with but are difficult to pull out especially when embedded higher than chest height. When a bolt is fired from the crossbow, the wielder is able to cause it to emit light that's as dim as a dull glow to as bright as a fresh torch, with nothing more than a mental command. The wielder chooses the color of the light and can choose to have the projectile emit light the moment the ammunition is launched, halfway to the target or immediately upon impact (Hit or miss). The bolt emits light for up to one minute, until the wielder mentally dismisses it or until a second projectile is enchanted with light. The wielder can choose to fire ammunition without enchanting them and can enchant up to two pieces of ammunition per hour. Knowledgeable PC's will have heard or military and mercenary strike teams who have used versions of this weapon as opener when dealing with small bands of enemies in dark conditions. Typically Brightstrike's wielder will bury a bolt in a wall or tree 6-8 feet off of the ground in the center of a cluster of poorly lit, unsuspected targets. The moment the bolt shines it's bright white light on the surprised targets, a half dozen other bowmen start taking easy shots at the well lit targets. By the time the victims have found their weapons and located the direction of the attack, they have suffered through several volleys of missiles. Attempts to cover or removed the embedded piton-bolt simply results in the creature being shot in the back for their trouble or a second illuminating bolt burying itself in the same area as the first. Typical enemies tend to scatter allowing the wielder and his allies to divide and conquer numerically superior foes or for the wielder to simply retreat after inflicting a few casualties and disrupting their rest."
36,"Caput Mortuum: A grim, somber-looking scythe with a haft of wood charred so badly that it resembles little more than charcoal. The blade is made of a lusterless gray metal and is wholly unadorned, except for a lone glyph engraved on each side, a circle with three small dots arranged in a “V” shape. The glyph glows a soft red whenever undead are within 100 feet of the wielder. When actively being wielded, the wood of the haft crumbles but the weapon's durability is unaffected. When the wielder uses the scythe to reap a life of a living intelligent creature, it steals a fraction of the victim's soul to create an indentured servant. The enslaved creature is an invisible, mindless and shapeless mass that can perform simple tasks at the wielder's mental command and functions as a loyal attendant. The being can exert up to 30 pounds of force and can perform simple tasks (It cannot attack) that a human servant could do, such as fetching things, cleaning, mending, folding clothes, lighting fires, serving food, and pouring wine. Once given a command, the spirit performs the task to the best of its ability until it completes the task, then waits for its next command. The unseen servant remains in existence for up to 24 hours, until it moves more than 60 feet away from the caster or until it takes any damage, at which point the being dissipates and the soul fragment is released to its afterlife to rejoin the rest of itself. The wielder can have up to a maximum of three unseen attendants at a time and must have the scythe on his person to command the servants to carry out a task."
37,"Serial Peacemaker: A hefty club fashioned out of a thick olive branch. Despite the obviously brutal possibilities of the weapon, it has a surprisingly benign appearance and radiates a small aura of calmness and rational thinking. The bearer feels a sense of encouragement from the wood's nature to foster peace, nonviolence and cooperation among anyone that they come across. If the wielder and his allies have genuinely attempted to negotiate in good faith (See Note) to avoid violence and bloodshed, the olive branch is appalled that their opponents have broken the truce and the weapon functions as a +1 for the entire combat encounter. The club stops providing a magical benefit if the wielder harms a creature who is unconscious, has surrendered or is otherwise no longer a threat and never provides a magical benefit to that wielder again. —Note: Negotiating in good faith can be as simple as quickly yelling “Throw down your weapons and you won't be harmed!” (An actually meaning it) or as involved as hours of involved peace talks. This takes at least one round of dedicated communication and nonviolence (Typically before combat begins) from the wielder or one of his allies, usually including a diplomacy type roll. The roll doesn't have to be successful as the club recognizes that its wielder has made the attempt."
38,"Touch-and-Go: A flamboyant rapier with a long, sleek blade and ornate hilt. The wire wrapped guard protects the wielder's hand and a weighted silver ball on the bottom of the hilt serves as decoration and a functional counterweight to the blade. Unlike than most blades, the rapier is decidedly a thrusting weapon, relying on the wielder's quick reflexes and fancy footwork to land a point and step away to safety. The rapier has been empowered to augment the bearer's natural grace and allows even a clumsy oaf to wield the weapon with a certain panache that almost looks like a gymnastic performance. The bearer is able to strike a creature and easily step away from the wounded foe before the enemy can even consider repaying the favor. When the wielder attacks a creature with the rapier, that creature can't make opportunity attacks against the wielder for the rest of the turn."
39,"Hell Root: A mace made from twisted, spiky brambles that were grown in grave soil, fertilized with cremated remains and watered with blood. A sickly looking fruit grows in a central cage and once ripe it will burst on the next hit spraying its acidic juices over the target. The fruit ripens by absorbing large amounts of fresh blood and instantly ripens whenever the wielder successfully lands a critical hit on a living creature. After a critical hit, on next successful attack with the mace, the player can roll all of the weapon's damage dice one additional time and add the result to the damage dealt by the critical hit, with the additional damage considered acid damage. After bursting over the target, a single seed remains within the bramble waiting to be fertilized with fresh blood, repeating the cycle."
40,"Caustic Talon: A scimitar made entirely from rare, enchanted ironwood and blessed by a fey spirit in the form of a forest dragon. The fey creature's personal style manifested itself on the weapon and the blade retains the grain of the ironwood, its dark grey and deep brown streaks are now lined with brilliant streams of emerald acid that slither between the grain of the wood. Deep green dragon scales run along the spine of the blade, turning into leaves as they meet the hilt. The vine-wrapped handle spirals down to the dragon-headed pommel, its face locked in a fierce snarl. When the weapon is swung, the acid in the blade can be heard sizzling in anticipation of landing a hit, but the caustic liquid never spills its power in waste. Half of the damage dealt by the scimitar is considered acid damage while the rest is normal for its type."
41,"Denn'bok: A simple piece of black oak one-foot in length with a large green crystal seamlessly embedded into the wood. An extremely knowledgeable PC with recognize this object as the legendary weapons of a secret order of guardians commonly known as the Rangers who dedicated their lives to protecting the lands and the people who lived in them. Much of the sect's history is shrouded in myth and legend with even the very name of the group causing heavy debate. What most historians can agree on is that the group operated out of places called “White Stars” (Whether those are dungeons, secrets hideouts or even ships, is unknown) and that “The One” was an important part of their beliefs or structure. It is unknown whether “The One” is a God, the group's founder, the current leader or some sort of prophet. What is known is that the warriors needed a weapon that could be easily hidden and could disable rather than kill. A creature holding the object can take an action equivalent to drawing a weapon to think the command word (Which is “Anla-shok”, the sect's name for themselves) which causes the wood to instantly extend to the length of a standard quarterstaff. The quarterstaff retracts instantly if the wielder wills it or it ceases to be held. It can be extended and retracted as much as desired and it is said the warriors even created their own fighting style around extending and retracting the weapon during combat to confuse and distract their enemies. The quarterstaff extends so quickly that it is almost as though is magically appears in the wielder's grasp often surprising his foes. The first time per combat that the wielder extends the staff as part of making an attack with it, he gains advantage on the attack roll. The wielder must practice this unusual technique for at least one hour per week in order to make use of the weapon as an element of surprise. While retracted and carried by a living creature the weapon does not register as magical for the purposes of detection spells. While the Denn'bok is extended the wielder (And only the wielder) is able to read a fine script that goes along the length of the staff: “We are the Rangers. We walk in the dark places no others will enter. We stand on the bridge, and no one may pass. We engage in battle, we do not retreat. We live for the One, we die for the One.”"
42,"Craftmaster: A warhammer that is a strangely intricate blending of weapon and tool. The item seems to be a weapon in size and weight but its general appearance bears far more resemblance to a blacksmith's, forging hammer. The holy symbol of the God of Warfare is stamped into the entirety of the hammer's face. A bearer can feel a sense of bloodlust from the weapon as well as a sense of camaraderie and appreciation and respect for all tools of war, no matter their humble beginnings. The warhammer possesses a Random Masterwork Weapon Bonus and once per day when the wielder defeats an opponent in armed combat while using the weapon, he may direct the implement to change form, causing it to gaining a new Random Masterwork Weapon Bonus while losing the benefit of the old one. Knowledgeable PC's will recognize this hammer as one of many from the God of Warfare's own forge where he works tirelessly to create marvelously lethal implements of battle. The deity takes pride in the skill, strategy and preparation of war, not just the killing and the warhammer's wielder can grant a divine blessing in the God's name. Once per day the wielder can touch the warhammer to a single nonmagical weapon (Or up to ten pieces of matching throwing weapons or ammunition) to bestow it with the skill of a master craftsman. The blessed weapon physically changes, gaining a Random Masterwork Weapon Bonus and prominently displays the God's holy symbol along its length. There can only be one such other weapon empowered at once and should a wielder bless a second weapon, the first weapon returns to its previous mundane form. The warhammer recognizes the skill of certain bearers and provides far more favorable results to those training in the creation of tools of battle. If the wielder is proficient in a skill that can create weapons such as blacksmith's tools, fletching, bowmaking or woodworking tools and has personally made at least one weapon in his lifetime, whenever the wielder would roll randomly to determine a masterwork bonus that the warhammer gains or bestows, the player instead chooses the specific result from the table instead of rolling. —Note: A DM who is using the Masterwork Bonus list on this blog should make sure to go through it first and make the PC aware ahead of time of any choices that he would not be allowed to choose for balance reasons. The warhammer is found with the following Masterwork Weapon Bonus = ^MasterworkWeaponBonuses^"
43,"Khopesh of the Sands: A traditional looking kopesh (Scimitar statistics) with a hilt made of human bone wrapped in sandy bandages. The weapon's grip bears the holy symbol of a Sun God primarily worshiped in desert communities; an ankh within a blazing sun. Knowledgeable PC's will know that weapons like these were created by the archpriests and master embalmers of the desert lands who prepared their dead in mummification rituals so that they could be resurrected by their God at a later time. Unfortunately the pyramids and burial sites of their deceased loved ones were routinely desecrated by necromancers who raised the preserved corpses as undead abominations, thus rendering that soul incapable of ever properly returning to its mortal form. An armory of these magically enchanted weapons were fashioned to repel the undead creations and guard the graves against future necromancers. The rage of the archpriests and embalmers burned long and cold and after they had created enough weapons to arm their own citizens, they began selling them abroad at cost, to ensure that all countries within any of their trade routes could stamp out those would defile the dead and raise them up. When used in combat, the wielder's hands are coated in a mixture of dust and desert sand and the weapon is treated as a +1 against undead creatures and any creature who has raised, created or commanded an undead creature in the past week. Undead creatures and those who has ever raised, created or commanded an undead being feel a horrific sense of revulsion when they touch the weapon and can never wield it proficiently."
