1,"Chillrend: A longsword bearing a leaf shaped blade of sharp blue ice which is freezing to the touch. Its iron handle is permanently frosted over and most creatures require gloves in order to wield the weapon without suffering frostbite. While drawn, the blade emanates a vapor as if it were experiencing sublimation, and constantly produces a hissing noise, similar to dry ice mixing with water. When used in combat, the wielder's hands become coated in a fine layer of frost (Which deals no damage and melts normally) and half of the damage dealt by the weapon is considered cold damage while the rest is normal for its type."
2,"Drown: A steel trident decorated with bronze barnacles along the upper part of its haft, Drown has a sea-green jewel just below the tines and a silver shell at the end of its haft. It floats on the surface if dropped onto water, and it floats in place if it is released underwater. The trident is always cool to the touch, and it is immune to any damage due to exposure to water. Drown contains a spark of Olhydra, the archomental Princess of Evil Water and the tiny fragment of her essence influences the bearer to become covetous and greedy. A long term bearer may discover his personality changing, finding that he is more likely demand and feeling deserving of the largest share of the spoils, and refuse to part with anything that's his. The bearer is aware that using the trident against others may grant him more gold to add to his horde and that causing pain and injury to others is worth it if the end result is more gold in his pocket. The bearer is never forced to act on these feelings but so long as he carries the weapon he may be swayed by its avarice. When the wielder lands a critical hit, instead of producing blood, ichor, tree sap, sloughs of undead flesh or other similar substance, the target shreds pure gold droplets. The equivalent of one gold coin per point of hit point damage dealt by the critical hit (In total, to a maximum limit of the amount of hit points the target has remaining), tumbles out of the target's body and falls to the ground. —Note: DM's can change the effect to function on the first time per day the wielder lands a critical hit if they feel their players will get distracted trying to abuse the effect to get rich rather than treating it as a fun, novel weapon."
3,"Rhindon: A kingly longsword with a pommel shaped like a golden lion's head and a red grip bisected by a gold ring. The sword has a silver blade with gold words engraved on both sides. One side reads: “When Aslan bares his teeth, winter meets its death.” while the other side states: ""When He Shakes His Mane, We Shall Have Spring Again.”. The weapon is extraordinarily durable and any wielder can plainly feel the solid construction under its unyielding form. The weapon is five times harder to damage than a typical longsword and never breaks, chips or dulls as a result of casual use and is all but impossible to break or damage as a result of combat, even when targeted by enemies who attempt sundering or weapon breaking techniques. The weapon and its sheath of matching design are immune to rust, age and mundane wear and tear. The weapon is treated as a +1 against wolves, dire-wolves, were-wolves and other canine creatures."
4,"Plague Bringer: A thick club made entirely out of wood so rotten its species is unidentifiable. It's covered in various colors of toxic mold and riddled with small holes made by crawling insects that burrow into the club and constantly skitter from hole to hole. The only patch of untainted wood on the entire weapon is the grip, which is tinted white and has symbol of a horse and a swarm of flies etched onto it. Small chunks of toxic mold, rotten wood and dead insects routinely fall off of the weapon leaving a trail of refuse in the wielder's wake. The mold on the club seems to regrow over the lost material and the burrowing insects will bring up fragments of rotted wood from the club's center to replace bits that have been lost. No matter how much of the club's material falls off, it never seems to get any lighter and never loses its structural integrity. Creatures in possession of the weapon feel mildly sick most of the time and occasionally feel as though the burrowing insects were crawling over their skin even when they aren't touching the club. Despite how he feels the bearer becomes objectively hale and hearty, seemingly at the expense of those around him. Or perhaps the club treats the bearer as some kind of symbiote using him to ferry the weapon to its next victim. All creatures with ten feet of the weapon (Excluding the bearer) suffer disadvantage on saving throws against disease, infection and sickness and the bearer gains advantage on those saves. A successful hit against a living creature introduces toxic splinters, black mold and burrowing maggots directly into the victim's flesh hampering their body's ability to heal. Whenever a living creature damaged by the weapon would be healed (By any source, power or ability whatsoever), roll the amount healed twice and use the lower result. Should the creature instead be healed for a non-rolled amount of hit points, reduce the healing by one point to a minimum of zero. The magical toxins are short lived and the reduced healing effect only lasts until the start of the wielder's next turn."
5,"Last Whisper: A shortbow made of pale gold wood with gold accents, surrounded by a faint bluish haze. Built into the arrow rest lies a pair of large curving fangs of an unknown animal, arrows are fired from between the teeth. Carved into the wood along the interior of the shaft is the phrase “You May Say Your Last Words, With A Whisper"". The weapon becomes completely invisible when it is in the possession of a creature who is being forced to whisper. The weapon makes no noise of any sort when it strikes a target and negates any sound the target would make as a result of being hit. Even if the wielder took the weapon into both hands and struck a gong as hard as they could, the result would only be silence. A creature struck by the weapon cannot utter any sounds louder than a barely audible whisper until the start of the wielder's next turn. While the weapon is being wielded and for one hour afterwards, the bearer cannot speak louder than a barely audible whisper. This does not hinder spellcasting (Unless the spell requires the target to hear the bearer) as the bearer is still able to speak but he cannot provide rallying cries to allies, give instructions, shout for help, or yell warnings. The forced whispering hinders the bearer's ability to properly project their personality and they suffer disadvantage on all charisma based checks that rely on them speaking. —Note: In game terms only creatures within five feet of the bearer or victim can hear them whispering in optimal conditions. During loud situations such as combat, thunderstorms or in a loud taverns, whispers cannot be heard at all."
6,"Cudgel of the Interrogator: A bloodstained and heavily worn club whose magic is activated whenever it strikes an intelligent creature. The wielder can either choose to deal normal club damage with the weapon or deal a single point of nonlethal damage which renders the victim unconscious but alive whenever it would normally kill. A creature struck by the Cudgel can only speak the truth during their next sentence. The struck creature is incapable of speaking if the words they consider or know to be untrue. However, the struck creature can make any statement they wish such as “I hope you die!”, “The sky is blue.” or “My name is X.” Being repeatedly struck with the Cudgel forces the creature to speak the truth again but it can be the same truth they said the last time. Victims will often repeat the same insult, state their name or simply state the color of a nearby wall or other incredibly obvious fact to get around the cudgel's magic."
7,"Bystander's Bullets: A grey bandolier containing 20 ornate sling bullets. Each piece of ammunition consists of a sealed glass orb filled with black and white liquids in a yin-yang design which are kept separate by a thick layer of glass. A knowledgeable PC can identify the liquids as holy and unholy water, essentially the distilled essence of good and evil separated by simple glass. The bullets can be launched from a sling normally, the projectiles are unnaturally attracted to neutral creatures changing course slightly to hit them. The glass shattering on impact splashing the target with both liquids. The holy and unholy water mix together finding a mutual enemy in those who have refused or refrained from taking a moral side. An intelligent neutral creature (A creature who is not overly good or evil, regardless if they are lawful or chaotic) is damaged by the mixture of holy and unholy water even if they would not normally be hurt by either of them. The holy water burns the target with white fire, putting off billowing clouds of pure steam, while the unholy water melts the target with black acid putting off trails of thick acrid smoke which curl downward. The sling bullets are considered +1 ammunition if the intelligent target is neutral, chaotic neutral, or lawful neutral. To all others the explosion of shards upon impact of the glass bullet along with the coating of noxious profane liquid and sterilizing sacred water deals as much damage as a mundane sling. —Note: In games with no strict alignment or moral code, the DM has final say on what creatures are valid targets. In such games, the bullets automatically impart to its wielder which creatures within 30 feet are moral bystanders (Valid targets) so the ammunition is not wasted."
8,"The Coward's Way: An ornate, gem studded, dueling rapier that is so gaudy it is nearly ceremonial in appearance. A proficient wielder will notice that despite its flamboyant appearance it is a functional lethal weapon with a few deadly secrets. This rapier was designed and enchanted for cheating in lethal duels by unscrupulous contestants. Pressing a small gem near the base of the grip causes the pommel to spring open revealing a hollow hilt that can fit two small darts. Twice per day, the wielder can press a different gem-button to magically propel a dart from disguised hole next to the base of the blade at a target within 15 feet. The attack and damage rolls are treated as though the wielder had thrown a dart that he was proficient in. This can be done once per round as part of making an attack with the rapier without penalty to either attack. Alternatively, the wielder can spend an action equivalent to an attack to aim and fire the dart (The wielder often levels the blade at the target during this time taunting them or saying “En garde!” to disguise the aiming action) which grants advantage on the attack roll. The rapier makes no sound when launching a projectile and the dart is rendered invisible for one minute after the being fired, making it nearly impossible for witnesses to notice that the wielder has cheated the duel. The sheer number of superfluous gems decorating the weapon make finding the gem-buttons by chance nearly impossible, even for an experienced dueling judge to discover during a routine weapon examination. The rapier is protected by minor shielding wards and when held or carried by a living creature it does not give off a magical aura and is not detectable as a magical object."
9,"Dragonglass Blade: A large sharp chunk of knapped obsidian with a leather strap wrapped around a dull section creating a hilt. Upon casual inspection it seems to be a crude stone knife, however perceptive PC's will notice a finely etched symbol of a dragon seated on a throne made of swords, which is mostly hidden under the leather. The dagger is considered a +1 weapon against undead creatures and beings consisting primarily of ice or snow. Obsidian is quite fragile however and whenever the wielder rolls a natural 1 on a hit with this weapon, they must roll an additional 1d4. If the roll is another natural 1, roll damage as normal and the weapon shatters, dealing half of the damage to the wielder as well as the target."
10,"Nightmare Lash: A smooth, jet black whip whose long sinuous cord that moves slightly of its own accord, curling into nightmarish shapes whenever it's seen out of the corner of one's eye. The whip flays the target's mind as well as their skin with each strike and half of the damage dealt by it is considered psychic damage while the rest is normal for its type. Whenever a being touches or is struck by the whip, that creature relives a fleeting instant of a long forgotten childhood nightmare, before the memory quickly submerges back into their subconscious. Twice per day, when the wielder lands a successful attack against an enemy he can choose to cause that creature to suffer from severe night terrors during their next eight hours (Consecutive or nonconsecutive) of sleep as they experience a vivid and specific Random Nightmare. The victim's sleep is plagued with thrashing and screaming as they frequently bolt awake terrified, drenched in cold sweat, their heart pounding heavily in their chest. The creature's sleep is so disturbed by the nightmares that they gain no benefits from the rest whatsoever."
11,"Hammered Drunk: A durable, travel sized, green steel tankard with the image of a warhammer etched upon it. Any alcoholic beverage drunk directly from the container tastes as though it is of a much better quality than it actually is. A creature holding the tankard can concentrate while touching it against another piece of iron or steel (Taking an action equivalent to drawing a weapon) to cause the cup to instantly transform into a full-sized warhammer. The weapon shows signs of obvious craftsmanship and the symbol of a master weaponsmith is etched on the warhammer's grip, marking it as a rare and valuable piece. The warhammer's damage dice increases by one step (See Note) to the next largest die. To return it to its original tankard state, the wielder must whisper “That'll do.” to the warhammer in Dwarven. —Note: For example, if a normal warhammer deals 1d8 damage wielded in one hand and 1d10 in two hands, Hammered Drunk deals 1d10 and 1d12 respectively."
12,Briar's Blight: A cold iron bastard sword that appears to have been grown rather than forged. The flanges of its elaborate hilt and elegant blade are set with strange stones glistening in shades deeper than emerald and blooming with growths of finest silver. The sharp blade glows with warm firelight equivalent to a candle when it's within 100 feet of a fey creature and the weapon is treated as a +1 against them. Fey creatures are never considered proficient with the weapon and may injure themselves wielding the cold iron and silver hilt.
13,"Moonblade: An elegant longsword of elven design proudly displaying an antique moonstone hilt. When the weapon is used in combat, the wielder experiences the faintest of spiritual connections to all those who have previously wielded the blade in battle. Elves in particular benefit greatly from this, as the longsword was forged and primarily owned by elves over its centuries of existence and elven wielders treat the weapon as a +1 due to the guidance of their ancestors spirits."
14,"Wyrmslayer: A bastard sword of elvish make, with a silver inlaid hilt and a pommel set with a light green stone. The crossguard is straight with a slight flare at each end and the weapon sports a fluted grip that can be wielded in two hands or one. The blade will begin to buzz aggressively if brought within one mile of a dragon. The buzzing will grow louder if the sword is brought closer and the sound itself is not only quite irritating and bothersome to a woken dragon but it is capable of waking a sleeping dragon as well. The weapon is treated as a +1 against dragons and other reptilian creatures that are predominantly covered in scales."
15,"Stormblade: A Dwarven longsword with a hilt wrought of gold with silver chasings and inset to the handle are four sapphires as well as one in the pommel, all perfectly round and smooth. The blade is a fine steel with a streak of glowing red that runs up the center which no darkness can diminish. The weapon is a masterwork of Dwarven craftsmanship and knowledgeable PCs will recognize it as Stormblade which was originally forged for the Thane of the Hylar. The weapon can never be marred, harmed or broken in any way, including through the use of magic and Stormblade is treated as a +1 when wielded by a dwarf."
16,"Fighter's Flaming Flamberge: A specially crafted greatsword with a wavy blade, resembling a tongue of flame in shape. When parrying, the undulating sword creates unpleasant vibrations which can be transmitted into the attacker's weapon, allowing a wielder to potentially block melee attacks made against him that he is aware of. Using an action equivalent to an attack of opportunity (See Note) the wielder may attempt to parry an incoming melee attack, increasing his armor class or physical defensiveness as if he was properly wielding a shield. The wielder may benefit from the armor class bonus (Typically a +2) even if he is already wielding a shield. The sinuous blade's resemblance to fire is furthered by the magical enchantment on it causing the metal to look like an oversized dancing candle flame. The illusionary fire glows slightly and responds movement causing the sword's flame to flicker and dance with each swing. The semblance of fire is backed by truly scorching heat and half of the damage dealt by the weapon is considered fire damage while the rest is normal for its type. The wielder must have practiced with the sword for at least one hour in the past week in order to remain accustomed to the vibrations and be considered proficient with it. —Note: If you're system doesn't use attacks of opportunity or interrupting actions use the following rule: Once the wielder parries an attack he is no longer able to do so until the start of his next turn."
17,"Celestial Fury: A katana of immaculate craftsmanship, the blade is extremely flexible, yet completely unbreakable and remains constantly honed to razor sharpness. Its hilt was wrapped in leather, granting it a comfortable grip adorned with a magnificently large pearl. Ancient characters for “Celestial Fury” are inscribed on the blade, which glow a pale violet hue and snap with electricity. The sheathe is made from the hide of a gray dragon and occasionally flash in hues of silver, blue and violet. The weapon's channels the fickle nature of the heavens within its blade and directs lethal jolts of power directly into the target's body, shocking the delicate nervous system and leaving smoking, flash burned skin. Half of the damage dealt by the weapon is considered lighting damage while the rest is normal for its type."
18,"Revenge: A finely honed dirk (Dagger statistics) made of hammered cold iron that always feel chill to the touch. The easily concealable, double edged, thrusting weapon lacks a crossguard and bears the phrase “Best Served Cold” in raised letters along the grip. The weapon deals numbing injuring leaving the victim covered in their own slushy blood, frozen in shock over being attacked. Half of the damage dealt by the weapon is considered cold damage while the rest is normal for its type. There is not an ounce of material or decoration on the dirk that is strictly necessary and its combat size cause the bearer to gain advantage on any checks made to conceal the weapon on his person."
19,"Frost Giant Fork: A massive utensil (Trident statistics.) that comes from the table of a frost giant. Latent jotun magic flows through this makeshift trident and drives the wielder's hunger to nearly aggressive levels. Once per round on his turn, when an attuned wielder successfully lands an attack with the fork he can immediately spend half of his total movement for the round to lunge at the target and attempt to bite him. The wielder's jaws and teeth become fortified to have the strength and density of the weapon's original owner, allowing this follow-up bite attack to deal damage equivalent to a dagger and protecting the wielder from injury. To attune to the trident, the bearer must touch the tip of their tongue to one the weapon's tines. For the next 48 hours after attunement, the bearer's hunger becomes almost insatiable and he needs to eat three times the normal amount every day, or risk starvation penalties. The wielder can renew the attunement at any time."
20,"Hallowed Courage: A wondrous and divine warhammer, forged and blessed by the great celestials above, upon the Anvil of Planes. Upon its great head are impossibly intricate etchings and depictions of the valiant doings of various archangels, and it constantly gleams with a sacred radiance. The grip of the hammer is comforted with beatific, angelic fabrics, and the handle is covered in supernal runs of sacrosanct power. The will of the gods forged into physical form, it is a beacon of hope in the darkness. When wielded, the weapon glows a comforting golden light equivalent to a candle and allied creatures within ten feet gain advantage on all rolls made to resist fear effects."
21,"Wavebreaker: A gleaming Greatsword made from the finest sea gold, found in the darkest depths of the sea and honed by crashing waves. The blade is set with a hilt of ^RandomColour^ coral, decorated with iridescent fish scales that ends with a large pearl that serves as the pommel. The sword strikes with the unstoppable power of the sea itself when its recently tasted the brine of its birth. Whenever the weapon is completely submerged in saltwater, it is treated as a +1 for the next hour."
22,"Stonecrusher: A great blunt maul with an iron beast-head at its tip, the weapon is a symbol of the eternal desire to unmake that which man has made and cast down his civilization so that no stone is left standing upon another. The weapon is treated as a +1 against animated creatures, artificial constructs and objects of any kind."
23,"The Baton of Whispers: A curious club hewn from dark hickory, it is twisted and tough, the wood is knotted near the base and at the end, and is roughly three and a half-feet long. Enemies hit by the baton are afflicted by horrible visions and whispers of dark truths they cannot comprehend and half of the damage dealt by the weapon is considered psychic damage while the rest is normal for its type. The horrific sensations plague the victim, hampering their ability to determine reality from illusion. Creatures damaged by the club have disadvantage to perception checks based on vision or hearing until the start of the wielder's next turn. Those who brandish the baton themselves are not safe from its effects, however. While the club is on their person, the bearer can hear the light sound of voices in the back of their mind. The voices are of men, women, and children alike and they whisper taunts that wear away at one's insecurities, secrets the bearer thought nobody could know, and sometimes just gibberish. Typically, they can be shut out and ignored, but they provide enough distraction to impose disadvantage on all hearing based perception checks the wielder makes while the weapon is being wielded and for one hour afterwards."
24,"Hellblade: A jagged, iron ^RandomSword^ whose blackened blade glows with heinous enchantments. Knowledgeable PC's are familiar with tales of Hellblades and it is said that they are razor-edged and honed on the souls of those who have fallen in battle to the malevolent Blood God's demonic soldiers. When held, the wielder's mind is filled with dark thoughts of cruelty, senseless violence and causing harm to innocents and the weapon itself radiates a palpable aura of ruthlessness and evil intentions. The weapon bears abyssal glyphs that forcibly draw from the wielder's mental and physical defenses, worsening his ability to protect himself from harm. The weapon is treated as a +1 but while the weapon is being wielded and for one hour afterwards, the bearer suffers a penalty of -1 on all of his saving throws. It is unknown if the sword was truly sharpened by using a tortured soul but the blade is incredibly keen and whenever the player roll a 1 on a die to calculate the weapon's damage (See Note), they can reroll the die until they receives a result that is not a 1. The malicious nature of the sword creates extreme discomfort in those pure and middling of heart and non-evil creatures are never considered proficient with the weapon. —Note: This only affects the weapon's damage die itself and not other sources of additional damage such as sneak attack, divine smite or spell effects."
25,"Bow of the Conqueror: An ornate, pristinely white longbow with gold gilding and the symbol of a horse and a crown etched onto its grip. Creatures in possession of the weapon feel urges to conquer and be victorious over others. The weapon rewards those who spread the message of their dominion over others and if the weapon is used to land a killing blow on an intelligent creature while being witnessed by at least three other non-allied, intelligent creatures, the weapon glows slightly and functions as a +1 for the next eight hours for that wielder only. Whenever the weapon is treated as a +1, a large golden crown appears atop the wielder's head. It is a convincing illusion and shines with golden light that's as bright as a torch. The eight hour timer is reset each time the wielder meets the enchantment's requirements."
