89,"A large iron box inside which can be found seven bolts of expensive silk dyed in rare colours. The box has three locks and sealing material set into the edge of the lid to prevent moisture and pests entering and ruining the contents. The box is not currently locked. On the side of the box are the remnants of a customs seal that shows the box was last used six years ago and gives partial identification of the shipper."
90,"An ivory-inlaid snuff box. A knowledgeable PC can determine that the decorative crest of a boar smashing a ship belonged to the infamous privateer Sir Brutus Blackwater. To the right expert, such a piece of history could fetch quite a hefty sum."
91,"A solid gold wine chalice encrusted with a diamond and ruby rim."
92,"An intricate mechanical clock with the inner workings exposed. Every day at noon the gears shift into a new configuration but the clock continues without missing a beat."
93,"An embroidered indigo silk robe with cloth-of-gold panels, blue gem-beaded sleeves and mink trim. The beads are lapis lazuli and there are 50 on each sleeve. It is suitable for a tall human woman and fit for nobility."
94,"Victory of Elora: A large and intricate tapestry showing the life of a great human cleric named Elora. A piece of the tapestry has been ripped out, what it missing is unknown, although Elora is shown with child in the next panes, so it's possible it to have been censored by an overzealous inquisitor. The tapestry is very valuable, the missing piece would make it nearly priceless."
95,"A strange coin that seems to be an amalgamation of copper, silver, gold, and platinum, shaped into the image of an eight pointed star. The faces of the coin both depict a warped, tentacle creature of aberrant origin."
96,"A heavy silver chalice. It is engraved with a myriad of blasphemous obscenities and polished to a fine finish. It is cool to the touch and the unholy object is a hateful mockery of the communion cup that holds consecrated wine in some religious ceremonies."
97,"A set of noble's clothing spun with gold and silver thread adorned with malachite and red quartz stones."
98,"A silver statuette of a saint that unscrews to reveal a hidden flask filled with holy water."
99,"Last Words: A scrimshawed bone bracelet, enchanted by an unknown restless spirit that often whispers indescribable commands to its bearer. Should the bearer rest a hand upon a dead creature, the bracelet whispers the last words they spoke before their death."
100,"An illustrated map of hell drawn on vellum fashioned from the skin of an angel."