94,"A petrified gecko on a length of chain. While worn, the bearer is able to speak to and understand geckos as if they shared a common language. However, every gecko the bearer speaks to attempts to sell him insurance. No gecko will help, give advice or deal with the bearer in any way until the user buys some form of insurance which takes 15 minutes or more. If the bearer already has some type of insurance, the lizard is quick to point out that they could save a bunch of money by switching to gecko."
95,"Mirror of Recent Past: An ornate hand mirror set in silver with the symbol of an hourglass engraved in the backing. When looked upon, the mirror displays the face of the last person (Other than the creature currently reflected by it) to have gazed into the mirror."
96,A silver chain headdress set with small onyx stones
97,"An elegant pen made from a raven's feather with a gold tipped nib. If dictated to, the quill writes by itself in the flawless calligraphy of a master scribe. The pen writes in an inexhaustible supply of gold colored ink but can only be made to write upon parchment, canvas or vellum."
98,Bellowing Bullhorn: A hollowed out horn of a large bull with a brass handle fastened to it. The pointed tip of the horn has been removed and trimmed in brass to provide a mouthpiece. The horn doubles volume of any creature that speaks or yells into it.
99,"Dreamcatcher, Pure: A small wooden loop with intricate geometric designs woven from sinew within the circle. Dozens of white beads are nestled at what seem to be focal points in the designs. More sinew strings hang down from the loop entwined with a handful of bright colorful feathers of various birds. If the Dreamcatcher is placed in a near a creature's head, that creature will not suffer from bad dreams. When the creature would have a nightmare, the dream instead goes into one of the white beads turning it black. Each time this happens some of the bright coloring of the feathers will be leached away (Slowly turning them grey) and become good dreams for the creature."
100,"Dreamcatcher, Corrupted: A small wooden loop with intricate geometric designs woven from sinew within the circle. Dozens of black beads are nestled at what seem to be focal points in the designs. More sinew strings hang down from the loop entwined with a handful of limp feathers of various birds in drab shades of grey and black. If the Dreamcatcher is placed in a near a creature's head, that creature will not experience good dreams. When the creature would have a pleasant dream, the dream instead goes into one of the black beads turning it white. Each time this happens some of the grey coloring of the feathers will be leached away (Slowly turning them brightly colored) and become bad dreams for the creature."